{
  "components": [
    {
      "id": "cmp-o002-u01-text",
      "kind": "reader_text",
      "license": "CC BY-SA 4.0",
      "path": "source/units/01-komputasi-bukti.qmd",
      "source": "src-o002-original"
    },
    {
      "id": "cmp-o002-u01-code",
      "kind": "software",
      "license": "MIT",
      "path": "source/code/unit01_experiment.py",
      "source": "src-o002-original"
    },
    {
      "id": "cmp-o002-u02-text",
      "kind": "reader_text",
      "license": "CC BY-SA 4.0",
      "path": "source/units/02-objek-fungsi.qmd",
      "source": "src-o002-original"
    },
    {
      "id": "cmp-o002-u02-code",
      "kind": "software",
      "license": "MIT",
      "path": "source/code/unit02_objects.py",
      "source": "src-o002-original"
    },
    {
      "id": "cmp-o002-u03-text",
      "kind": "reader_text",
      "license": "CC BY-SA 4.0",
      "path": "source/units/03-array-vektorisasi.qmd",
      "source": "src-o002-original"
    },
    {
      "id": "cmp-o002-u03-code",
      "kind": "software",
      "license": "MIT",
      "path": "source/code/unit03_arrays.py",
      "source": "src-o002-original"
    },
    {
      "id": "cmp-o002-u04-text",
      "kind": "reader_text",
      "license": "CC BY-SA 4.0",
      "path": "source/units/04-visualisasi-integritas.qmd",
      "source": "src-o002-original"
    },
    {
      "id": "cmp-o002-u04-code",
      "kind": "software",
      "license": "MIT",
      "path": "source/code/unit04_visualization.py",
      "source": "src-o002-original"
    },
    {
      "id": "cmp-o002-u05-text",
      "kind": "reader_text",
      "license": "CC BY-SA 4.0",
      "path": "source/units/05-eksak-simbolik-sage.qmd",
      "source": "src-o002-original"
    },
    {
      "id": "cmp-o002-u05-code",
      "kind": "software",
      "license": "MIT",
      "path": "source/code/unit05_symbolic.py",
      "source": "src-o002-original"
    },
    {
      "id": "cmp-o002-u06-text",
      "kind": "reader_text",
      "license": "CC BY-SA 4.0",
      "path": "source/units/06-titik-mengambang-stabilitas.qmd",
      "source": "src-o002-original"
    },
    {
      "id": "cmp-o002-u06-code",
      "kind": "software",
      "license": "MIT",
      "path": "source/code/unit06_floating.py",
      "source": "src-o002-original"
    },
    {
      "id": "cmp-o002-u07-text",
      "kind": "reader_text",
      "license": "CC BY-SA 4.0",
      "path": "source/units/07-rancangan-eksperimen.qmd",
      "source": "src-o002-original"
    },
    {
      "id": "cmp-o002-u07-code",
      "kind": "software",
      "license": "MIT",
      "path": "source/code/unit07_experiment_design.py",
      "source": "src-o002-original"
    },
    {
      "id": "cmp-o002-u08-text",
      "kind": "reader_text",
      "license": "CC BY-SA 4.0",
      "path": "source/units/08-pengujian-validasi.qmd",
      "source": "src-o002-original"
    },
    {
      "id": "cmp-o002-u08-code",
      "kind": "software",
      "license": "MIT",
      "path": "source/code/unit08_validation.py",
      "source": "src-o002-original"
    },
    {
      "id": "cmp-o002-u09-text",
      "kind": "reader_text",
      "license": "CC BY-SA 4.0",
      "path": "source/units/09-data-konfigurasi-provenans.qmd",
      "source": "src-o002-original"
    },
    {
      "id": "cmp-o002-u09-code",
      "kind": "software",
      "license": "MIT",
      "path": "source/code/unit09_provenance.py",
      "source": "src-o002-original"
    },
    {
      "id": "cmp-o002-u10-text",
      "kind": "reader_text",
      "license": "CC BY-SA 4.0",
      "path": "source/units/10-otomasi-pipa.qmd",
      "source": "src-o002-original"
    },
    {
      "id": "cmp-o002-u10-code",
      "kind": "software",
      "license": "MIT",
      "path": "source/code/unit10_pipeline.py",
      "source": "src-o002-original"
    },
    {
      "id": "cmp-o002-u11-text",
      "kind": "reader_text",
      "license": "CC BY-SA 4.0",
      "path": "source/units/11-eksperimen-numerik.qmd",
      "source": "src-o002-original"
    },
    {
      "id": "cmp-o002-u11-code",
      "kind": "software",
      "license": "MIT",
      "path": "source/code/unit11_numerical.py",
      "source": "src-o002-original"
    },
    {
      "id": "cmp-o002-u12-text",
      "kind": "reader_text",
      "license": "CC BY-SA 4.0",
      "path": "source/units/12-proyek-akhir.qmd",
      "source": "src-o002-original"
    },
    {
      "id": "cmp-o002-u12-code",
      "kind": "software",
      "license": "MIT",
      "path": "source/code/unit12_capstone.py",
      "source": "src-o002-original"
    }
  ],
  "course": {
    "id": "B80",
    "prerequisite": "A30",
    "project_id": "O002",
    "title": "Komputasi Matematis dan Eksperimen yang Dapat Direproduksi"
  },
  "cursor": {
    "boundary": "complete 12-unit id-ID edition",
    "edition_complete": true,
    "last_complete_unit": "o002.u12",
    "next_unit": null
  },
  "language": "id-ID",
  "qa": [
    {
      "evidence": "12 units; stable IDs; five hint-and-solution exercises per unit",
      "id": "qa-o002-source-structure",
      "status": "pass"
    },
    {
      "evidence": "complete standard-library/scientific-Python test suite at final boundary",
      "id": "qa-o002-tests",
      "status": "pass"
    },
    {
      "evidence": "Quarto HTML and LuaLaTeX PDF build at final boundary",
      "id": "qa-o002-reader-build",
      "status": "pass"
    },
    {
      "evidence": "all final PDF pages rendered and inspected",
      "id": "qa-o002-pdf-visual",
      "status": "pass"
    },
    {
      "evidence": "no audio or interactive widget surface in this edition",
      "id": "qa-o002-audio",
      "status": "not_applicable"
    }
  ],
  "relations": [
    {
      "from": "o002.u01",
      "to": "o002.u02",
      "type": "precedes"
    },
    {
      "from": "o002.u02",
      "to": "o002.u03",
      "type": "precedes"
    },
    {
      "from": "o002.u03",
      "to": "o002.u04",
      "type": "precedes"
    },
    {
      "from": "o002.u04",
      "to": "o002.u05",
      "type": "precedes"
    },
    {
      "from": "o002.u05",
      "to": "o002.u06",
      "type": "precedes"
    },
    {
      "from": "o002.u06",
      "to": "o002.u07",
      "type": "precedes"
    },
    {
      "from": "o002.u07",
      "to": "o002.u08",
      "type": "precedes"
    },
    {
      "from": "o002.u08",
      "to": "o002.u09",
      "type": "precedes"
    },
    {
      "from": "o002.u09",
      "to": "o002.u10",
      "type": "precedes"
    },
    {
      "from": "o002.u10",
      "to": "o002.u11",
      "type": "precedes"
    },
    {
      "from": "o002.u11",
      "to": "o002.u12",
      "type": "precedes"
    },
    {
      "from": "o002.u01",
      "to": "cmp-o002-u01-text",
      "type": "uses_component"
    },
    {
      "from": "o002.u01",
      "to": "cmp-o002-u01-code",
      "type": "uses_component"
    },
    {
      "from": "o002.u02",
      "to": "cmp-o002-u02-text",
      "type": "uses_component"
    },
    {
      "from": "o002.u02",
      "to": "cmp-o002-u02-code",
      "type": "uses_component"
    },
    {
      "from": "o002.u03",
      "to": "cmp-o002-u03-text",
      "type": "uses_component"
    },
    {
      "from": "o002.u03",
      "to": "cmp-o002-u03-code",
      "type": "uses_component"
    },
    {
      "from": "o002.u04",
      "to": "cmp-o002-u04-text",
      "type": "uses_component"
    },
    {
      "from": "o002.u04",
      "to": "cmp-o002-u04-code",
      "type": "uses_component"
    },
    {
      "from": "o002.u05",
      "to": "cmp-o002-u05-text",
      "type": "uses_component"
    },
    {
      "from": "o002.u05",
      "to": "cmp-o002-u05-code",
      "type": "uses_component"
    },
    {
      "from": "o002.u06",
      "to": "cmp-o002-u06-text",
      "type": "uses_component"
    },
    {
      "from": "o002.u06",
      "to": "cmp-o002-u06-code",
      "type": "uses_component"
    },
    {
      "from": "o002.u07",
      "to": "cmp-o002-u07-text",
      "type": "uses_component"
    },
    {
      "from": "o002.u07",
      "to": "cmp-o002-u07-code",
      "type": "uses_component"
    },
    {
      "from": "o002.u08",
      "to": "cmp-o002-u08-text",
      "type": "uses_component"
    },
    {
      "from": "o002.u08",
      "to": "cmp-o002-u08-code",
      "type": "uses_component"
    },
    {
      "from": "o002.u09",
      "to": "cmp-o002-u09-text",
      "type": "uses_component"
    },
    {
      "from": "o002.u09",
      "to": "cmp-o002-u09-code",
      "type": "uses_component"
    },
    {
      "from": "o002.u10",
      "to": "cmp-o002-u10-text",
      "type": "uses_component"
    },
    {
      "from": "o002.u10",
      "to": "cmp-o002-u10-code",
      "type": "uses_component"
    },
    {
      "from": "o002.u11",
      "to": "cmp-o002-u11-text",
      "type": "uses_component"
    },
    {
      "from": "o002.u11",
      "to": "cmp-o002-u11-code",
      "type": "uses_component"
    },
    {
      "from": "o002.u12",
      "to": "cmp-o002-u12-text",
      "type": "uses_component"
    },
    {
      "from": "o002.u12",
      "to": "cmp-o002-u12-code",
      "type": "uses_component"
    }
  ],
  "schema_version": "o002.backend.v1",
  "sources": [
    {
      "id": "src-o002-original",
      "identity": "local independently authored source",
      "license": "CC BY-SA 4.0 text; MIT code",
      "role": "original",
      "title": "O002 original Indonesian coursebook",
      "used_in_current_units": true
    },
    {
      "id": "src-o002-walls",
      "identity": "commit 0687916182ab3ddc9e922d4a6eb603609ba91c36; tree b66a9c79aa7144a75d3f83ba53bba4ff8961f91b",
      "license": "CC BY-NC-SA 4.0; separate/unclear component rights retained",
      "role": "bounded_donor",
      "title": "Mathematical Python",
      "used_in_current_units": false
    },
    {
      "id": "src-o002-rse",
      "identity": "commit 62217e6606842ab9752fcf8e73954d1eb4a3cf07; tree f570f30bb8ace202550c474e81eb3414e8976be5",